{
  "schema_version": "net.capability.advertisement.v1",
  "capability_id": "capability_demo_generic_external",
  "node_id": "node_lan_demo",
  "capability_label": "Generic external demo capability",
  "capability_kind": "generic_external",
  "capability_family": "generic",
  "capability_scope": "external",
  "capability_state": "declared",
  "constraints": {
    "max_input_units": 512,
    "max_output_units": 512,
    "streaming_supported": false,
    "batch_supported": true,
    "requires_authority": true
  },
  "metadata": {
    "declared_by": "net_spine_4",
    "note": "generic external advertisement only",
    "compatibility": "generic_external"
  },
  "advertised_at_unix_ms": 1700000020400
}
