{
  "schema_version": "net.capability.advertisement.v1",
  "capability_id": "capability_demo_receipt_emit",
  "node_id": "node_localhost_service_demo",
  "capability_label": "Receipt emit demo capability",
  "capability_kind": "receipt_emit",
  "capability_family": "receipt",
  "capability_scope": "service",
  "capability_state": "declared",
  "constraints": {
    "max_input_units": 128,
    "max_output_units": 128,
    "streaming_supported": false,
    "batch_supported": false,
    "requires_authority": true
  },
  "metadata": {
    "declared_by": "net_spine_4",
    "note": "receipt transport advertisement only; authority is not claimed",
    "compatibility": "net_fixture"
  },
  "advertised_at_unix_ms": 1700000020300
}
