{
  "schema_version": "net.capability.advertisement.v1",
  "capability_id": "capability_demo_neural_llm_decode",
  "node_id": "node_external_demo",
  "capability_label": "Neural LLM decode demo capability",
  "capability_kind": "neural_llm_decode",
  "capability_family": "neural",
  "capability_scope": "external",
  "capability_state": "declared",
  "constraints": {
    "max_input_units": 2048,
    "max_output_units": 512,
    "streaming_supported": true,
    "batch_supported": false,
    "requires_authority": true
  },
  "metadata": {
    "declared_by": "net_spine_4",
    "note": "demo advertisement only; implementation is not claimed",
    "compatibility": "generic_external"
  },
  "advertised_at_unix_ms": 1700000020000
}
