{
  "schema_version": "net.capability.advertisement.v1",
  "capability_id": "capability_demo_metrics_stream",
  "node_id": "node_local_process_demo",
  "capability_label": "Metrics stream demo capability",
  "capability_kind": "metrics_stream",
  "capability_family": "metrics",
  "capability_scope": "process",
  "capability_state": "declared",
  "constraints": {
    "max_input_units": 128,
    "max_output_units": 128,
    "streaming_supported": true,
    "batch_supported": false,
    "requires_authority": true
  },
  "metadata": {
    "declared_by": "net_spine_4",
    "note": "demo metrics advertisement only",
    "compatibility": "net_fixture"
  },
  "advertised_at_unix_ms": 1700000020200
}
